{
  "$schema": "https://json-schema.org/draft/2020-12/schema",
  "$id": "handoff-schema/surfaces.schema.json",
  "title": "Surface and interactive-state inventory for a .dc.html handoff",
  "type": "object",
  "required": ["schema_version", "project", "runtime_sha256", "records", "counts", "unresolved"],
  "additionalProperties": false,
  "properties": {
    "schema_version": { "const": "1.0" },
    "project": { "type": "string" },
    "generated": { "type": "string", "format": "date" },
    "runtime_sha256": { "type": "string", "pattern": "^[0-9a-f]{64}$" },
    "records": { "type": "array", "items": { "$ref": "#/$defs/surface" } },
    "counts": {
      "type": "object", "required": ["routes", "toggling_sc_ifs"], "additionalProperties": false,
      "properties": {
        "routes": { "$ref": "#/$defs/count" },
        "toggling_sc_ifs": { "$ref": "#/$defs/count" },
        "other_sc_ifs": { "type": "object", "description": "sc-ifs that only switch content variants or breakpoints, listed so the total reconciles.", "additionalProperties": true }
      }
    },
    "unresolved": { "type": "array", "items": { "type": "object", "required": ["item", "reason"], "properties": { "item": { "type": "string" }, "reason": { "type": "string" } } } }
  },
  "$defs": {
    "count": {
      "type": "object", "required": ["by_dc", "total", "covered_by"], "additionalProperties": false,
      "properties": { "by_dc": { "type": "object", "additionalProperties": { "type": "integer" } }, "total": { "type": "integer" }, "covered_by": { "type": "object", "additionalProperties": { "type": "string" } }, "note": { "type": "string" } }
    },
    "state": {
      "type": "object", "required": ["name", "state_keys", "how_to_reach"], "additionalProperties": false,
      "properties": {
        "name": { "type": "string" },
        "state_keys": { "type": "object", "description": "Logic state (or derived value) that defines this state.", "additionalProperties": true },
        "sc_if_tpl_ids": { "type": "array", "items": { "type": "string" }, "description": "sc-if elements whose value flips for this state." },
        "how_to_reach": { "type": "string", "description": "User action, plus the call that reaches it programmatically: a setState call on the live logic instance, and, where the state needs the draft's own store to hold something first (a signed-in account, a basket with a gift note), the draft's own store call written with literal arguments, such as MM.account.signIn() or MM.cart.setGift({ on: true }). Intake runs only such a call, on a plain-object global the draft defines." },
        "animation_ids": { "type": "array", "items": { "type": "string" } },
        "how_to_reach_structured": {
          "type": "object", "additionalProperties": false,
          "description": "The same way in as how_to_reach, machine-readable. Cloning reads setState and storeCalls before the prose.",
          "properties": {
            "setState": { "type": "object", "description": "The object passed to setState on the live logic instance.", "additionalProperties": true },
            "storeCalls": { "type": "array", "description": "The draft's own store calls, with literal arguments, run before the state is opened.", "items": { "type": "object", "required": ["path"], "additionalProperties": false, "properties": { "path": { "type": "string", "pattern": "^[A-Za-z_$][\\w$]*(\\.[A-Za-z_$][\\w$]*)+$", "description": "For example MM.account.signIn." }, "args": { "type": "array" } } } },
            "event": { "type": "object", "description": "The user action that reaches the state.", "required": ["type", "target"], "additionalProperties": false, "properties": { "type": { "type": "string", "description": "A DOM event type such as click." }, "target": { "type": "string", "description": "A data-part id or a data-dc-tpl index." } } }
          }
        },
        "state_key_sources": { "type": "object", "description": "Where each state_keys key lives: state (a key of the logic state), derived (computed by renderVals, not settable) or instance (a field on the logic instance).", "additionalProperties": { "enum": ["state", "derived", "instance"] } },
        "breakpoint": {
          "type": "object", "description": "The width threshold this state depends on, in one form.", "required": ["basis", "op", "value"], "additionalProperties": false,
          "properties": { "basis": { "const": "state.w" }, "op": { "enum": [">=", "<", "<=", ">"] }, "value": { "type": "number" } }
        }
      }
    },
    "surface": {
      "type": "object",
      "required": ["id", "kind", "name", "dc", "template_tpl_id", "route", "opened_by", "closed_by", "states", "time_dependent"],
      "additionalProperties": false,
      "properties": {
        "id": { "type": "string", "pattern": "^S-[0-9]{2,3}$" },
        "kind": { "enum": ["page", "global", "header", "footer", "menu", "drawer", "backdrop", "panel", "accordion", "modal", "form", "form-step", "result"] },
        "name": { "type": "string" },
        "dc": { "type": "string" },
        "template_tpl_id": { "oneOf": [{ "type": "string" }, { "type": "array", "items": { "type": "string" } }, { "type": "null" }] },
        "route": { "type": ["string", "null"], "description": "Hash route, '*' for every route, null if not route-bound." },
        "page_key": { "type": ["string", "null"] },
        "blocks": { "type": "array", "items": { "type": "string" } },
        "breakpoints": { "type": "array", "items": { "enum": ["mobile", "tablet", "desktop"] } },
        "parent": { "type": ["string", "null"] },
        "opened_by": { "type": "string" },
        "closed_by": { "type": "string" },
        "states": { "type": "array", "minItems": 1, "items": { "$ref": "#/$defs/state" } },
        "time_dependent": {
          "type": "object", "required": ["value", "reason"], "additionalProperties": false,
          "properties": { "value": { "type": "boolean" }, "reason": { "type": "string" } }
        },
        "source": { "type": "string", "description": "Function, getter or ref that drives the surface." },
        "notes": { "type": "string" }
      }
    }
  }
}
