{
  "schema_version": "1.0",
  "project": "Ward End Eye Care",
  "generated": "2026-10-11",
  "runtime_sha256": "8fe7df74405f3c55f49b7249c74ea1397e65d07dea2b1bd3b4a489bec2e28cbe",
  "records": [
    {
      "id": "S-01",
      "dc": "Eye Care Birmingham",
      "time_dependent": {
        "value": true,
        "reason": "measure() polls container width every 120ms for 40 ticks, then every 800ms; ResizeObserver also updates state.w."
      },
      "parent": null,
      "kind": "global",
      "name": "Storefront shell",
      "template_tpl_id": "0",
      "route": "*",
      "opened_by": "Always rendered",
      "closed_by": "Never",
      "breakpoints": [
        "mobile",
        "tablet",
        "desktop"
      ],
      "states": [
        {
          "name": "mobile",
          "state_keys": {
            "w": "< 768"
          },
          "how_to_reach": "Resize the container below 768px, or L = dcLogic('Eye Care Birmingham'); L.setState({w:375})"
        },
        {
          "name": "tablet",
          "state_keys": {
            "w": "768–1023"
          },
          "how_to_reach": "L.setState({w:800})"
        },
        {
          "name": "desktop",
          "state_keys": {
            "w": ">= 1024"
          },
          "how_to_reach": "L.setState({w:1400})"
        }
      ],
      "source": "measure(), renderVals() breakpoint flags",
      "notes": "Breakpoints are measured on the root container width (state.w), not the viewport. Extra steps: 620 (lens options one-up), 1060 (nav compact, filter drawer), 1100 (lens aside), 1160 (header phone), 1280 (four-up product grid). Accounts: state.user (null when signed out), auth, acct, addr, subs, placed, lastOrder."
    },
    {
      "id": "S-02",
      "dc": "Eye Care Birmingham",
      "time_dependent": {
        "value": false,
        "reason": "Reads no Date, Math.random, localStorage or timers."
      },
      "parent": "S-01",
      "kind": "global",
      "name": "Trust ticker",
      "template_tpl_id": "7",
      "route": "*",
      "opened_by": "Always rendered",
      "closed_by": "Never",
      "breakpoints": [
        "mobile",
        "tablet",
        "desktop"
      ],
      "states": [
        {
          "name": "static row (fits as many claims as the width allows)",
          "state_keys": {
            "w": ">= 768"
          },
          "how_to_reach": "L.setState({w:1400})",
          "animation_ids": [
            "PS-01"
          ]
        },
        {
          "name": "marquee",
          "state_keys": {
            "w": "< 768"
          },
          "how_to_reach": "L.setState({w:375})",
          "animation_ids": [
            "CA-01"
          ]
        }
      ],
      "source": "renderVals().ticker"
    },
    {
      "id": "S-03",
      "dc": "Eye Care Birmingham",
      "time_dependent": {
        "value": false,
        "reason": "Reads no Date, Math.random, localStorage or timers."
      },
      "parent": "S-01",
      "kind": "header",
      "name": "Header",
      "template_tpl_id": "13",
      "route": "*",
      "opened_by": "Always rendered (position:sticky; top:0)",
      "closed_by": "Never",
      "breakpoints": [
        "mobile",
        "tablet",
        "desktop"
      ],
      "states": [
        {
          "name": "top",
          "state_keys": {
            "scrolled": false
          },
          "how_to_reach": "Scroll to the top; L.setState({scrolled:false})"
        },
        {
          "name": "scrolled (shrunk)",
          "state_keys": {
            "scrolled": true
          },
          "how_to_reach": "Scroll window past 40px; L.setState({scrolled:true})",
          "animation_ids": [
            "TR-02",
            "TR-06"
          ]
        },
        {
          "name": "full nav",
          "state_keys": {
            "w": ">= 1060"
          },
          "how_to_reach": "L.setState({w:1400})",
          "sc_if_tpl_ids": [
            "22",
            "31"
          ]
        },
        {
          "name": "compact nav (Menu button)",
          "state_keys": {
            "w": "< 1060"
          },
          "how_to_reach": "L.setState({w:900})",
          "sc_if_tpl_ids": [
            "16"
          ]
        },
        {
          "name": "signed out (account icon goes to sign-in)",
          "state_keys": {
            "user": null
          },
          "how_to_reach": "L.setState({user:null})"
        },
        {
          "name": "signed in (taupe dot on the account icon)",
          "state_keys": {
            "user": "{first,last,email,mobile}"
          },
          "how_to_reach": "Sign in on /my-account; L.setState({user:{first:\"Aisha\",last:\"Khan\",email:\"aisha.khan@example.com\",mobile:\"\"}})",
          "sc_if_tpl_ids": [
            "41"
          ]
        }
      ],
      "source": "navPad, logoW/H, wordmarkSize, navFull/navCompact, phoneDisplay (>= 1160); account button (openAccount, signedIn); bag shows an icon with an overlapping count below 768"
    },
    {
      "id": "S-04",
      "dc": "Eye Care Birmingham",
      "time_dependent": {
        "value": false,
        "reason": "Reads no Date, Math.random, localStorage or timers."
      },
      "parent": "S-03",
      "kind": "menu",
      "name": "Mega menu",
      "template_tpl_id": "50",
      "route": "*",
      "opened_by": "Hover or keyboard focus on Sunglasses / Brands / Lenses / Help after 150ms (instant when switching panels); click on touch devices (hover: none); click on Brands toggles; footer \"All brands\" toggles Brands",
      "closed_by": "Escape; pointerdown outside the header; pointer leaving the header; mouseenter on About, phone or \"Glasses\"; picking an item; go()",
      "breakpoints": [
        "desktop"
      ],
      "states": [
        {
          "name": "closed",
          "state_keys": {
            "mega": null
          },
          "how_to_reach": "L.setState({mega:null})"
        },
        {
          "name": "Sunglasses",
          "state_keys": {
            "mega": "sun"
          },
          "how_to_reach": "Hover Sunglasses; L.setState({mega:\"sun\"})",
          "sc_if_tpl_ids": [
            "49",
            "52"
          ],
          "animation_ids": [
            "TR-03",
            "CA-03"
          ]
        },
        {
          "name": "Brands",
          "state_keys": {
            "mega": "brands"
          },
          "how_to_reach": "Hover or click Brands; L.setState({mega:\"brands\"})",
          "sc_if_tpl_ids": [
            "49",
            "70"
          ],
          "animation_ids": [
            "TR-04",
            "CA-03",
            "TR-09",
            "PS-04"
          ]
        },
        {
          "name": "Lenses",
          "state_keys": {
            "mega": "lenses"
          },
          "how_to_reach": "Hover Lenses; L.setState({mega:\"lenses\"})",
          "sc_if_tpl_ids": [
            "49",
            "82"
          ],
          "animation_ids": [
            "TR-05",
            "CA-03",
            "TR-10"
          ]
        },
        {
          "name": "Help",
          "state_keys": {
            "mega": "help"
          },
          "how_to_reach": "Hover Help; L.setState({mega:\"help\"})",
          "sc_if_tpl_ids": [
            "49",
            "89"
          ],
          "animation_ids": [
            "CA-03"
          ]
        }
      ],
      "source": "state.mega, megaSun/megaBrands/megaLenses/megaHelp"
    },
    {
      "id": "S-05",
      "dc": "Eye Care Birmingham",
      "time_dependent": {
        "value": false,
        "reason": "Reads no Date, Math.random, localStorage or timers."
      },
      "parent": "S-03",
      "kind": "drawer",
      "name": "Mobile menu",
      "template_tpl_id": "1162",
      "route": "*",
      "opened_by": "Menu button (below 1060px)",
      "closed_by": "× button; any link (go() sets menuOpen:false)",
      "breakpoints": [
        "mobile",
        "tablet"
      ],
      "states": [
        {
          "name": "closed",
          "state_keys": {
            "menuOpen": false
          },
          "how_to_reach": "L.setState({menuOpen:false})"
        },
        {
          "name": "open",
          "state_keys": {
            "menuOpen": true
          },
          "how_to_reach": "Tap Menu; L.setState({menuOpen:true})",
          "sc_if_tpl_ids": [
            "1161"
          ],
          "animation_ids": [
            "CA-45",
            "CA-46",
            "CA-47",
            "CA-48",
            "CA-49",
            "CA-50",
            "CA-51"
          ]
        }
      ],
      "source": "toggleMenu",
      "notes": "Page scroll is locked while open (J-08)."
    },
    {
      "id": "S-06",
      "dc": "Eye Care Birmingham",
      "time_dependent": {
        "value": false,
        "reason": "Reads no Date, Math.random, localStorage or timers."
      },
      "parent": "S-01",
      "kind": "footer",
      "name": "Footer",
      "template_tpl_id": "1121",
      "route": "*",
      "opened_by": "Always rendered",
      "closed_by": "Never",
      "states": [
        {
          "name": "default",
          "state_keys": {},
          "how_to_reach": "Scroll to the bottom of any page",
          "animation_ids": [
            "TR-49",
            "TR-50",
            "TR-51"
          ]
        }
      ],
      "source": "template"
    },
    {
      "id": "S-07",
      "dc": "Eye Care Birmingham",
      "time_dependent": {
        "value": false,
        "reason": "Reads no Date, Math.random, localStorage or timers."
      },
      "parent": "S-01",
      "kind": "global",
      "name": "WhatsApp button (floating)",
      "template_tpl_id": "1158",
      "route": "*",
      "opened_by": "Always rendered (fixed, bottom right)",
      "closed_by": "Never",
      "breakpoints": [
        "mobile",
        "tablet",
        "desktop"
      ],
      "states": [
        {
          "name": "icon + \"Ask me anything\"",
          "state_keys": {